straight right, ude uke, ko, ganmen shuto
straight right, ude uke, ko, left side uraken
straight right, soto ude uke, kiba, right elbow check, left side hiji, right kage zuki
straight right, nagashi uke, kiba, yoko haitto, cross shuto
straight right, nagashi, kiba, right elbow check, left yoko shuto, right downward uraken
straight right, soto cruss shuto uke, ko (sink), left elbow check, yoko haitto
right blow, cross shuto uke, ko, right cross shuto uchi (ko)
right blow, cross shuto uke, zen, mawashi zuki, kage zuki, double ura zuki
club blow (or right blow), age uke, zen, double ura tsuki [on our current charts the attack is "right roundhouse"]
overhead club blow, jodan juji uke, zen, inside armbreak, double ura zuki [the inside armbreak does not appear explicitly on the old charts]
overhead club blow, jodan juji uke, zen, jodan tettsui
side club blow, lnside double ude uke, kiba, side hiji [it's "rear hiji" on the old charts]
overhead chain, soto age uke, ko (sink), kage zuki
low knife thrust, left gedan barai, zen, inside armbreak, left uraken [the inside armbreak is not explicit on the old charts, old charts also say "or club"]
low knife thrust, right gedan barai, zen, outside armbreak, right downward uraken [again armbreak not explicit on old charts]
upward knife thrust, gedan juji uke, zen (step back), forward armbreak, right gyaku zuki [it is "kage tsuki" on the old charts and no explict arm break]
straight lapel hold, tensho ude uke, neko, gyaku tsuki [straight lapel hold on current charts, label grab on old ones]
belt grab, gedan ulna uke, neko, downward uraken
front choke, kakiwake uke, zen (step back), upwards hiji, jodan tettsui [old charts don't have this technique, rather have same as next but no sakotsu]
front choke, kakiwake uke, zen (step back), sakotsu, double ura tsuki
